{
  "jobId": "render-test-001",
  "demoPath": "D:/Cs2Highlight/test-data/match.dem",
  "player": {
    "steamId": "76561198000000001",
    "name": "Player1"
  },
  "segment": {
    "startTick": 81150,
    "endTick": 81900
  },
  "video": {
    "width": 1920,
    "height": 1080,
    "fps": 60,
    "fov": 90
  },
  "outputDirectory": "D:/Cs2Highlight/output/render-test-001",
  "timeoutSeconds": 600
}
